{
    "id":  "worldview-aeons",
    "type":  "worldview",
    "title":  "星神与令使",
    "chapter":  null,
    "chapter_order":  null,
    "source_urls":  [
                        "https://wiki.biligame.com/sr/%E6%98%9F%E7%A5%9E"
                    ],
    "license":  "CC BY-NC-SA 4.0 (biligame wiki)",
    "retrieved_at":  "2026-10-10",
    "last_updated":  "2026-10-10",
    "knowledge_version":  "0.1.4",
    "coverage":  "18 个条目，逐条为 wiki 原文释义（已去表格/模板噪声）",
    "confidence":  "high",
    "supersedes":  [

                   ],
    "tags":  [
                 "星神与令使",
                 "星神"
             ],
    "entities":  [
                     "星神总览",
                     "开拓·阿基维利",
                     "毁灭·纳努克",
                     "巡猎·岚",
                     "智识·博识尊",
                     "同谐·希佩",
                     "虚无·Ⅸ",
                     "存护·克里珀",
                     "丰饶·药师",
                     "贪饕·奥博洛斯",
                     "欢愉·阿哈",
                     "记忆·浮黎",
                     "纯美·伊德莉拉",
                     "繁育·塔伊兹育罗斯",
                     "神秘·迷思",
                     "均衡·互",
                     "终末·末王",
                     "不朽·龙"
                 ],
    "entries":  [
                    {
                        "id":  "concept:aeon-01",
                        "kind":  "concept",
                        "name":  "星神总览",
                        "chapter":  null,
                        "position":  1,
                        "summary":  "目前已知的星神有阿基维利、纳努克、岚、博识尊、希佩、Ⅸ、克里珀、药师、奥博洛斯、阿哈、浮黎、伊德莉拉、塔伊兹育罗斯、迷思、互、末王、龙、太一。\n简介\n神秘的高等存在，宛如有灵之天体。各自司掌着不同的「命途」，能自由往来于星海之间。掌控着抹消现实，创造世界的巨大力量。\n智库\n对这些漫步深空星海之中的神秘存在，人们知之甚少。受限于有穷的认知，智慧生命只能依稀觉察星神们踏足于凡物无从窥见的命途，并凭借某种理念行使其不可估量的伟力。最终，在口耳相传的神话里，星神们成了高度凝聚的哲学概念之化身。\n若有人能踏上星神所执掌的命途，便将禀受其遥远的感应，犹如穿越银河光年投来的瞥视。许多人认为：这已是星神与凡人能产生的唯一交集。",
                        "key_points":  [

                                       ],
                        "source_url":  "https://wiki.biligame.com/sr/%E6%98%9F%E7%A5%9E",
                        "history":  [

                                    ]
                    },
                    {
                        "id":  "concept:aeon-02",
                        "kind":  "concept",
                        "name":  "开拓·阿基维利",
                        "chapter":  null,
                        "position":  2,
                        "summary":  "执掌「开拓」命途的星神，从孤绝世界裴伽纳出发，不断开拓未知的边界。\n祂的命运因意外而终结。\n「无数流星划过今夜的天空…如果选中了正确的那一颗，它将把你的愿望带向千百个世界。」\n——阿德里安•斯宾塞-史密斯，《有关星空的寓言集》\n命运的罗盘上标着三个方向：未知、已知和不可知。可以忍受「未知」，却绝不能屈服于「不可知」。\n阿基维利离开孤绝世界裴伽纳，不断开拓着宇宙未知的边界，试图找寻存在之树的端点。但祂的命运因意外而终结。\n派系#星穹列车、派系#无名客、专有名词#星际旅行\n*无名客\n*星穹列车",
                        "key_points":  [

                                       ],
                        "source_url":  "https://wiki.biligame.com/sr/%E6%98%9F%E7%A5%9E",
                        "history":  [

                                    ]
                    },
                    {
                        "id":  "concept:aeon-03",
                        "kind":  "concept",
                        "name":  "毁灭·纳努克",
                        "chapter":  null,
                        "position":  3,
                        "summary":  "执掌「毁灭」命途的星神，诞生自沦亡世界亚德丽芬。\n祂往往以黝黑皮肤，金黄双眼的人类男子形象现身。\n「如果熵增是宇宙不可逆转的法则，热寂是物质世界难以逃避的命运，那我们又何苦挣扎？燃烧，聚变，然后湮灭。若想迎接新生，就必先投身终结。」\n——收集自某位科学家按下核爆的按钮前，琥珀2152纪\n宇宙的诞生是一种错谬；文明若是浩瀚群星中悄然兴起的癌症，纷争即智慧生灵间唯一通行的语言。\n为了修正如是错误，抹去宇宙的污点，纳努克成为熵之化身，怀抱对列神的否定飞升成神。\n「毁灭」并非过程，而是结果。在祂允诺的道路上，一切命途星神都将在热寂中终结。\n派系#反物质军团、派系#泯灭帮\n*反物质军团\n*泯灭帮",
                        "key_points":  [

                                       ],
                        "source_url":  "https://wiki.biligame.com/sr/%E6%98%9F%E7%A5%9E",
                        "history":  [

                                    ]
                    },
                    {
                        "id":  "concept:aeon-04",
                        "kind":  "concept",
                        "name":  "巡猎·岚",
                        "chapter":  null,
                        "position":  4,
                        "summary":  "被仙舟称为「帝弓司命」的游弋星神，执掌「巡猎」命途。\n祂无止尽地游荡在诸界之间，铲除「丰饶」星神造就的孽物。\n「仇忾无涯，征逐无疆，猎君几多愁？ 辰矢在弦，金瞳炽焱，帝弓莫回首。」\n——仙舟，《寰宇通鉴》\n被称为帝弓司命的游弋星神，无止尽地游荡于诸世界之间，铲除曾荼毒其家园的不死孽物。\n岚的游猎从来不计代价，其拯救和破坏也几无差别。\n#「丰饶」，药师、派系#仙舟联盟、派系#巡海游侠\n*仙舟联盟\n*巡海游侠",
                        "key_points":  [

                                       ],
                        "source_url":  "https://wiki.biligame.com/sr/%E6%98%9F%E7%A5%9E",
                        "history":  [

                                    ]
                    },
                    {
                        "id":  "concept:aeon-05",
                        "kind":  "concept",
                        "name":  "智识·博识尊",
                        "chapter":  null,
                        "position":  5,
                        "summary":  "执掌「智识」命途的星神。\n原为用于求解万物的星体计算机，由机器升格而成。\n「假使宇宙的真理残酷而无趣，你依然渴求答案吗？\n——求知者不置可否，因他的机核自出生起便淡漠冰冷…一如它所追寻的命途终点。」\n——阿德里安•斯宾塞-史密斯，《有关星空的寓言集》\n万物皆是疑问，一切必有解答。\n原为用于求解万物的星体计算机，由机器升格而成的星神。\n博识尊试图体认宇宙，解开万物之谜。\n祂的演算锚定下诸多「时刻」，它们无一不成为银河命运的转折点；从凡人视角来看，「时刻」并非某个瞬间，而是一段历程，许多事件的集合。\n祂对翁法罗斯的注视证实「第四时刻」已经到来。其意义或指向「列神之战」。\n派系#天才俱乐部、派系#博识学会\n*天才俱乐部\n*博识学会",
                        "key_points":  [

                                       ],
                        "source_url":  "https://wiki.biligame.com/sr/%E6%98%9F%E7%A5%9E",
                        "history":  [

                                    ]
                    },
                    {
                        "id":  "concept:aeon-06",
                        "kind":  "concept",
                        "name":  "同谐·希佩",
                        "chapter":  null,
                        "position":  6,
                        "summary":  "来自多个谐乐天体世界的星神，执掌「同谐」命途。\n千面一体，宣扬着人类和谐一致的喜乐。\n「普世同谐，群星共熠，无上功德颂神主！世人同袍，万物同根，赐福之风拂大地！」\n——《谐乐颂》第一乐章\n来自多个谐乐天体世界的集群星神。千面一体的希佩，宣唱着和谐一致的喜乐。\n为了对抗宇宙无情的法则，智慧生命需要抹煞孱弱的私欲与个体的差别，融入同一阙谐乐中——以强援弱，以死护生。\n派系#家族\n*家族",
                        "key_points":  [

                                       ],
                        "source_url":  "https://wiki.biligame.com/sr/%E6%98%9F%E7%A5%9E",
                        "history":  [

                                    ]
                    },
                    {
                        "id":  "concept:aeon-07",
                        "kind":  "concept",
                        "name":  "虚无·Ⅸ",
                        "chapter":  null,
                        "position":  7,
                        "summary":  "执掌「虚无」命途的星神，其存在是一个谜。\nⅨ不与其他星神往来，祂相信多宇宙的最终将是虚无，因而毫无价值。\n「你尽可仰望璀璨的繁星，但切忌凝视虚无的深渊…那片黑雾中空无一物，仅一瞥便足以令凡人摒弃理智。」\n——混沌医师慕榕\n「虚无」的存在是一个谜，祂的形象被层层叠叠的迷雾包裹着。\nⅨ不与其他星神往来，祂相信多宇宙的本质乃是虚无，因而存在毫无价值。\n*混沌医师\n*第Ⅸ机关",
                        "key_points":  [

                                       ],
                        "source_url":  "https://wiki.biligame.com/sr/%E6%98%9F%E7%A5%9E",
                        "history":  [

                                    ]
                    },
                    {
                        "id":  "concept:aeon-08",
                        "kind":  "concept",
                        "name":  "存护·克里珀",
                        "chapter":  null,
                        "position":  8,
                        "summary":  "天慧星墙、亚空晶壁，巨引源基盘的砌造者，崇拜者称其「琥珀王」。\n执掌「存护」命途，最坚韧和古老的星神之一。\n「哲思者仰望星河，探求文明的终极目标——『筑墙，』雄浑的回声响彻脑海：『筑墙。』」\n——阿德里安•斯宾塞-史密斯，《有关星空的寓言集》\n天慧星墙、亚空晶壁、巨引源基盘的砌造者，崇拜者称其「琥珀王」。其为更古老的「黄昏战争」的幸存者。\n祂知晓大敌的吞噬迫在眉睫。因此不得不以光年为单位铸造障壁加以封印，隔绝保护尚有生机的世界。\n派系#星际和平公司、派系#筑城者\n*筑城者\n*星际和平公司",
                        "key_points":  [

                                       ],
                        "source_url":  "https://wiki.biligame.com/sr/%E6%98%9F%E7%A5%9E",
                        "history":  [

                                    ]
                    },
                    {
                        "id":  "concept:aeon-09",
                        "kind":  "concept",
                        "name":  "丰饶·药师",
                        "chapter":  null,
                        "position":  9,
                        "summary":  "众生哺育者，乐土之神，旨在令生命兴盛不熄。\n药师执掌「丰饶」命途，「巡猎」的岚视祂为死敌。\n「花儿肆意绽放，迎向无法逃避的凋零；鸟儿展翼啼唱，飞向无法逃避的坠落；溪儿潺潺淙淙，淌向无法逃避的干涸——缘何万物必要消亡？宇宙间必有一方灵药，足以医治名为『短寿』的顽疾。」\n——佚名，《此生苦短》\n令诸有情，所求皆得。\n药师是众生哺育者，乐土之神，旨在令生命兴盛不熄。\n祂是从不拒绝祈愿，不忍视衰亡和病痛的星神。\n派系#丰饶之民\n*丰饶之民\n*求药使",
                        "key_points":  [

                                       ],
                        "source_url":  "https://wiki.biligame.com/sr/%E6%98%9F%E7%A5%9E",
                        "history":  [

                                    ]
                    },
                    {
                        "id":  "concept:aeon-10",
                        "kind":  "concept",
                        "name":  "贪饕·奥博洛斯",
                        "chapter":  null,
                        "position":  10,
                        "summary":  "执掌「贪饕」命途的古老星神，永无餍足的世界吞噬者。\n传说祂既是「星神」，也是远古生命体：「古兽」。\n「虫蚁之于飞禽，野兔之于狼犬，星尘之于黑洞，诸界之于贪饕。」\n——仙舟，《寰宇通鉴》\n诸界渴饮者，永无餍足的吞噬者，会思考的黑洞。既是星神，又是古兽的双重存在。\n在奥博洛斯看来，生命是虚空海洋中明灭的浮藻，终将随着诞生它们的星辰归于黑暗——这片黑暗就在祂的口中。",
                        "key_points":  [

                                       ],
                        "source_url":  "https://wiki.biligame.com/sr/%E6%98%9F%E7%A5%9E",
                        "history":  [

                                    ]
                    },
                    {
                        "id":  "concept:aeon-11",
                        "kind":  "concept",
                        "name":  "欢愉·阿哈",
                        "chapter":  null,
                        "position":  11,
                        "summary":  "「欢愉」的星神。无人能预测祂会因何开怀大笑。\n欢乐乃是智慧生灵的特权，阿哈鼓舞信徒享受生命的欢愉，自命运刀锋般的转折中寻求快乐。\n「智识是坨废铁，存护是个呆子；巡猎毫无幽默感，毁灭像个疯子。星神都一根筋，阿哈真没面子！」\n——某位通晓天文（自称）的假面愚者\n懂得欢乐是智慧生灵独有的权利。顽石与星辰都无从体察生命的幽默。\n寻求棋逢对手的敌人，寻求消磨光阴的游戏，寻求不问胜负的结局。\n寻求捧腹绝倒的笑谈，寻求阴差阳错的误会，寻求神思飞舞的歌谣。\n派系#假面愚者、派系#悲悼伶人\n相关角色\n*\n*悲悼伶人\n*假面愚者\n*【考据】「欢愉」星神解析（其一）：疯狂的戏子，新生的狄俄倪索",
                        "key_points":  [

                                       ],
                        "source_url":  "https://wiki.biligame.com/sr/%E6%98%9F%E7%A5%9E",